{
  "schema_version": 1,
  "prompt": "Three ceramic vessels rest on a table: one tall narrow vase at the back, one round bowl at the front left, and one lidded jar at the front right. A small chip marks the bowl's rim. The vessels do not overlap.",
  "model": "anima",
  "styles": [
    {
      "id": "computational.density-plot",
      "intensity": 0.8
    },
    {
      "id": "animfinish.contour-cadence",
      "intensity": 0.6
    }
  ],
  "locked_axes": [],
  "conflict_policy": "last_wins"
}
